<?xml version="1.0"?>
<!DOCTYPE Bestellung SYSTEM "Bestellung.dtd">
<Bestellung xmlns="https://www.w3schools.com/bestellung"
            xmlns:xsi="http://www.w3.org/2001/XMLSchema-instance"
            xsi:schemaLocation="https://www.w3schools.com/bestellung schema/Bestellung.xsd">
    <BestellNr>123456</BestellNr>
    <BestellDatum>2023-01-01</BestellDatum>
    <BestellZeit>12:00:00</BestellZeit>
    <KundenNr>123456</KundenNr>
    <KundenName>Muster AG</KundenName>
    <Adressen>
        <Rechnungsadresse>
            <Anrede>Herr</Anrede>
            <Vorname>Hans</Vorname>
            <Name>Muster</Name>
            <Strasse>Musterstrasse</Strasse>
            <StrasseNr>1</StrasseNr>
            <PLZ>4132</PLZ>
            <Ort>Muttenz</Ort>
            <Land>Schweiz</Land>
        </Rechnungsadresse>
        <Lieferadresse>
            <Firma>Muster AG</Firma>
            <Anrede>Herr</Anrede>
            <Vorname>Hans</Vorname>
            <Name>Muster</Name>
            <Strasse>Musterstrasse</Strasse>
            <StrasseNr>1</StrasseNr>
            <PLZ>4132</PLZ>
            <Ort>Muttenz</Ort>
            <Land>Schweiz</Land>
        </Lieferadresse>
    </Adressen>
    <Warenkorb>
        <Artikel>
            <ArtikelNummer>10000001</ArtikelNummer>
            <Bezeichnung>Sattel</Bezeichnung>
            <Menge>1</Menge>
            <ArtikelPreis>500</ArtikelPreis>
            <Waehrung>CHF</Waehrung>
            <MWST>38.5</MWST>
            <MWSTSatz>7.7</MWSTSatz>
            <TotalPreis>538.5</TotalPreis>
        </Artikel>
        <Artikel>
            <ArtikelNummer>20000001</ArtikelNummer>
            <Bezeichnung>Stiefel</Bezeichnung>
            <Menge>2</Menge>
            <ArtikelPreis>200</ArtikelPreis>
            <Waehrung>CHF</Waehrung>
            <MWST>30.8</MWST>
            <MWSTSatz>7.7</MWSTSatz>
            <TotalPreis>430.8</TotalPreis>
        </Artikel>
    </Warenkorb>
    <TotalPreis>969.3</TotalPreis>
    <TotalMWST>69.3</TotalMWST>
</Bestellung>